{
  "recommendation_id": "USCIRF-REC-2026-001",
  "report_year": 2026,
  "addressee": "Secretary of State",
  "country": "China",
  "category": "Sanctions",
  "recommendation_text": "USCIRF recommends designation based on documented systematic violations.",
  "rationale": "USCIRF recommends designation based on documented systematic violations.",
  "related_violations": [
    "China",
    "Iran",
    "Russia"
  ]
}